{
  "id": "retro",
  "name": "Retro / Pixel",
  "nameZh": "像素复古",
  "category": "theme",
  "description": "Pixel art aesthetic with neon accents and retro typography",
  "descriptionZh": "像素风、霓虹色、等宽字体，怀旧数字感",
  "author": "core",
  "references": [],
  "variables": {
    "--color-primary": "#ff0080",
    "--color-primary-hover": "#cc0066",
    "--color-bg": "#0a0a1a",
    "--color-surface": "#12122b",
    "--color-text": "#00f0ff",
    "--color-text-secondary": "#a0a0c0",
    "--color-accent": "#fcee0a",
    "--color-border": "#ff0080",
    "--border-radius": "0px",
    "--border-width": "2px",
    "--border-color": "#ff0080",
    "--shadow-x": "0px",
    "--shadow-y": "0px",
    "--shadow-blur": "16px",
    "--shadow-spread": "0px",
    "--shadow-color": "rgba(255, 0, 128, 0.5)",
    "--font-family": "'Press Start 2P', 'Fusion Pixel SC', 'ZCOOL QingKe HuangYou', 'Courier Prime', monospace",
    "--font-weight": "400",
    "--font-weight-bold": "400",
    "--font-size-base": "12px",
    "--font-size-sm": "10px",
    "--font-size-lg": "16px",
    "--font-size-xl": "20px",
    "--font-size-xxl": "28px",
    "--line-height": "2.2",
    "--backdrop-blur": "0px",
    "--bg-opacity": "1",
    "--glow-intensity": "1",
    "--glow-color": "#ff0080"
  },
  "specialTuning": [
    { "variable": "--glow-color", "label": "Neon Color", "labelZh": "霓虹颜色", "type": "color" },
    { "variable": "--shadow-blur", "label": "Glow Intensity", "labelZh": "发光强度", "type": "range", "min": 0, "max": 30, "step": 1, "unit": "px" }
  ],
  "keyProperties": [
    { "property": "font-family: pixel", "explanation": "Pixel fonts for both Latin and Chinese are the retro signature", "explanationZh": "中西文都用点阵像素字体，这是复古风的核心标识" },
    { "property": "text-shadow: neon glow", "explanation": "Neon glow evokes a CRT screen", "explanationZh": "霓虹发光效果营造 CRT 屏幕感" },
    { "property": "color: #00f0ff", "explanation": "Cyan text on near-black nods to early terminals", "explanationZh": "深色底上的青色文字致敬早期终端" }
  ]
}
