{
  "id": "dark-mode",
  "name": "Dark Mode",
  "nameZh": "深色模式",
  "category": "theme",
  "description": "Dark background with reduced brightness and focused content",
  "descriptionZh": "深色背景，降低亮度，聚焦内容本身",
  "author": "core",
  "references": ["https://m3.material.io/styles/color/dark-theme"],
  "variables": {
    "--color-primary": "#a855f7",
    "--color-primary-hover": "#c084fc",
    "--color-bg": "#09090b",
    "--color-surface": "#18181b",
    "--color-text": "#fafafa",
    "--color-text-secondary": "#a1a1aa",
    "--color-accent": "#2dd4bf",
    "--color-border": "#27272a",
    "--border-radius": "16px",
    "--border-width": "1px",
    "--border-color": "#27272a",
    "--shadow-x": "0px",
    "--shadow-y": "8px",
    "--shadow-blur": "24px",
    "--shadow-spread": "0px",
    "--shadow-color": "rgba(0, 0, 0, 0.5)",
    "--font-family": "'Inter', 'PingFang SC', 'Microsoft YaHei UI', 'Microsoft YaHei', 'Noto Sans CJK SC', 'Noto Sans SC', sans-serif",
    "--font-weight": "400",
    "--font-weight-bold": "600",
    "--backdrop-blur": "0px",
    "--bg-opacity": "1"
  },
  "specialTuning": [],
  "keyProperties": [
    { "property": "background: #09090b", "explanation": "Near-black, not pure black, reduces eye strain", "explanationZh": "接近纯黑但不是纯黑的基底，减少视觉疲劳" },
    { "property": "color: #fafafa", "explanation": "Soft white instead of pure white lowers harsh contrast", "explanationZh": "柔和白而非纯白，降低对比刺激" },
    { "property": "border: low-contrast", "explanation": "Subtle borders separate surfaces without glare", "explanationZh": "低对比边框提供微弱分隔" }
  ]
}
