{
  "id": "editorial",
  "name": "Editorial",
  "nameZh": "杂志编辑",
  "category": "modern",
  "description": "Warm paper, ink typography and hairline rules — a print-magazine feel with large serif headlines",
  "descriptionZh": "暖色纸张、墨色排版与细线分隔，大号衬线标题带来印刷杂志感",
  "author": "core",
  "references": ["https://fonts.google.com/specimen/Newsreader"],
  "variables": {
    "--color-primary": "#1c1a17",
    "--color-primary-hover": "#3b3630",
    "--color-bg": "#f3efe6",
    "--color-surface": "#fbf8f2",
    "--color-text": "#1c1a17",
    "--color-text-secondary": "#6b645a",
    "--color-accent": "#d9481f",
    "--color-border": "#d9d1c2",
    "--border-radius": "2px",
    "--border-width": "1px",
    "--border-color": "#cfc6b5",
    "--shadow-x": "0px",
    "--shadow-y": "0px",
    "--shadow-blur": "0px",
    "--shadow-spread": "0px",
    "--shadow-color": "transparent",
    "--font-family": "'Newsreader', 'Noto Serif SC', 'Songti SC', 'STSong', 'SimSun', Georgia, serif",
    "--font-weight": "400",
    "--font-weight-bold": "500",
    "--font-size-base": "17px",
    "--font-size-xl": "34px",
    "--font-size-xxl": "60px",
    "--line-height": "1.55",
    "--backdrop-blur": "0px",
    "--bg-opacity": "1"
  },
  "specialTuning": [
    { "variable": "--font-size-xxl", "label": "Headline Size", "labelZh": "标题字号", "type": "range", "min": 32, "max": 88, "step": 2, "unit": "px" }
  ],
  "keyProperties": [
    { "property": "font-family: Newsreader", "explanation": "A high-contrast editorial serif with optical sizes, from headline to body", "explanationZh": "带光学尺寸的高对比衬线字体，标题和正文都耐看，是编辑风的核心" },
    { "property": "border: 1px hairline", "explanation": "Hairline rules instead of shadows keep the structure calm", "explanationZh": "细线分隔代替阴影，结构清晰克制" },
    { "property": "background: warm paper", "explanation": "Off-white paper tones feel like print, not a screen", "explanationZh": "米白纸张色降低屏幕感，更像印刷品" }
  ]
}
